{
  "_doc": "Jefe del acto 2 (RF-001b), donde empieza la GESTION (ADR 0043). Un modificador: «Marca de muerte» (markStar) deja sin perks al titular DE CAMPO en el que la build concentra los suyos; castiga la build que lo canaliza todo por un jugador. Plantilla orca de violencia, quality 46->40 al recalibrar contra la tabla revisada de la ADR 0033 (la fila del acto 2 se mueve poco: 35-50% para una build correcta). Medido: 10,3 / 41,7 / 66,6 / 76,7. Es la puerta que separa a las doctrinas de compra: la contextual la pasa el 49,6% de las veces y la gastadora el 35,2% (docs/fase2-diseno.md 19). RECALIBRADO POR LA ADR 0050 P2 (quality 40 -> 44): el promedio de dos tiradas hace que la diferencia de construccion pese vez y media mas, asi que la escalera entera sube y la celda BUENA se iba a 76,1 frente al 72 que pide su banda. Con 44 mide 8,0 / 39,4 / 67,3 / 80,3, las cuatro dentro de banda y sin necesitar el margen de medida. Ver docs/fase2-diseno.md 22. RECALIBRADO POR LA ADR 0074, que cierra AT-B (quality 46 -> 44): con la muestra que resuelve el margen -64 plantillas x 16 partidos = 5.120 por celda, ocho semillas, error tipico de una celda 0,20-0,89- la celda BUENA media 58,30 (ET 0,71 de una muestra, 0,25 sobre el agregado de 40.960 partidos), 1,70 por debajo de su suelo de 60, y estaba fuera de banda desde antes: la muestra vieja de 32 x 4 la daba en 62,66 porque no resolvia +-2,5. Se ablanda el jefe, que es lo que la ADR 0056 autoriza, y NO se toca la tabla. Medido a quality 44: 14,30 / 42,55 / 63,91 / 83,23, las cuatro dentro. La eleccion de 44 y no 45 es maximin sobre el margen mas estrecho: con 45 la escalera da 13,85 / 40,05 / 60,47 / 81,50 y la celda BUENA queda a 0,47 de su suelo (0,7 errores tipicos), con 44 el margen minimo es 0,70 en la celda INCOHERENTE (1,1 errores tipicos). El corredor del acto 2 es de 45 puntos (60 - 15) y la escalera que produce el catalogo mide 45,6 a quality 46 y 49,6 a quality 44: cabe, pero sin holgura, que es el mismo problema Y-10 del acto 1. Coste medido sobre 1.200 runs por lado: run 20,33 -> 20,75, suelo 10,92 -> 11,33 (ninguna significativa), hueco del acto 2 intacto en 13,48, y contextualAdvantage 3,83 -> 2,50 (diferencia emparejada -1,33, ET 0,24): ablandar una puerta comprime la ventaja de construir, que es la ADR 0065 leida al reves. Ver docs/fase2-diseno.md 37.",
  "id": "the_hunt",
  "act": 2,
  "name": {
    "es": "La Cacería",
    "en": "The Hunt"
  },
  "template": {
    "race": "Orc",
    "quality": 44,
    "level": 6,
    "perks": [
      {
        "slot": 0,
        "perk": "safety_net"
      },
      {
        "slot": 0,
        "perk": "sweeper_keeper"
      },
      {
        "slot": 1,
        "perk": "own_third_anchor"
      },
      {
        "slot": 1,
        "perk": "bruised_knuckles"
      },
      {
        "slot": 2,
        "perk": "own_third_anchor"
      },
      {
        "slot": 2,
        "perk": "last_ditch"
      },
      {
        "slot": 3,
        "perk": "center_conductor"
      },
      {
        "slot": 3,
        "perk": "brute_boots"
      },
      {
        "slot": 4,
        "perk": "brute_boots"
      },
      {
        "slot": 4,
        "perk": "bruised_knuckles"
      },
      {
        "slot": 5,
        "perk": "pivot_duo"
      },
      {
        "slot": 5,
        "perk": "diagonal_press"
      },
      {
        "slot": 6,
        "perk": "box_predator"
      },
      {
        "slot": 6,
        "perk": "forward_line"
      }
    ],
    "styles": {
      "1": "Brute",
      "2": "Brute",
      "4": "Brute",
      "6": "Brute"
    }
  },
  "modifiers": [
    {
      "id": "death_mark",
      "name": {
        "es": "Marca de muerte",
        "en": "Death Mark"
      },
      "kind": "markStar"
    }
  ],
  "gate": {
    "playerLevel": 6,
    "targets": {
      "incoherent": {
        "max": 15
      },
      "correct": {
        "min": 35,
        "max": 50
      },
      "good": {
        "min": 60,
        "max": 72
      },
      "excellent": {
        "min": 70,
        "max": 85
      }
    }
  }
}
