{
  "_doc": "Jefe final (RF-001c): plantilla integramente legendaria, DOS modificadores de regla y una condicion de derrota propia (D-9). «Porteria sellada» apaga los perks que suben el remate a puerta y «Cerrojo» (pushBack) vacia el tercio atacante; «El campeon conserva el titulo» convierte el empate al final del tiempo reglamentario en derrota, y anula entre el 13% y el 20% de las victorias en el campo. RECALIBRADO POR LA ADR 0049 (quality 28 -> 24): bajar la recompensa de liga a 1-de-2 baja la build con la que se llega al acto 3 (13,0 perks -> 8,6) y con quality 28 el escalon MUY BUENA se quedaba en 49,1 frente al 55 que pide su banda; ablandarlo sube tambien la fila CORRECTA, que pasa a ser la unica celda de las doce que necesita el margen de medida. Calibrado antes contra la tabla revisada de la ADR 0033: la columna del acto 3 es la mas estrecha (pide <10% para una build incoherente y >=55% para una muy buena, 45 puntos de escalera) y con «Cerrojo» en la columna 5 el catalogo solo daba 41. Subir la columna a 6 —el cerrojo vacia el tercio atacante, no medio campo— ensancha la escalera a 47 puntos y permite subir la calidad del jefe de 20 a 28 sin aplastar el escalon superior. Medido: 6,1 / 28,8 / 46,2 / 57,7. RECALIBRADO POR LA ADR 0050 P2 (quality 24 -> 29): con la escalera mas pronunciada, la celda CORRECTA se iba a 36,9 frente al 28 que pide su banda. Con 29 mide 6,1 / 26,3 / 43,6 / 60,3: es la primera configuracion en la que las CUATRO celdas de este jefe caen dentro de banda sin el margen de medida, incluida la que arrastraba el aviso AB-D desde el paquete AB. La ventana es estrecha -entre 28 y 30 de calidad una de las dos celdas centrales se sale- porque la banda pide 12 puntos entre CORRECTA y BUENA y la escalera medida da 13. Ver docs/fase2-diseno.md 22. Despues la ADR 0050 P1 lo subio a 31 (bb8d249). RECALIBRADO POR LA ADR 0193 (quality 31 -> 25): el saque de puerta de BX-8 baja los goles (-0,2/-0,3 por partido) y eso endurece a este jefe por sus dos canales a la vez -menos victorias en el campo y mas empates que «El campeon conserva el titulo» convierte en derrota-, y la celda MUY BUENA ya estaba roja (42) desde antes. Con 25 las cuatro celdas caen dentro de su banda en las semillas 1 y 2 (MUY BUENA al borde, 50,16): 4,6/19,4/47,7/51,5 y 4,0/18,2/46,7/50,2.",
  "id": "eternal_crown",
  "act": 3,
  "name": {
    "es": "La Corona Eterna",
    "en": "The Eternal Crown"
  },
  "template": {
    "race": "Undead",
    "quality": 25,
    "level": 8,
    "rarity": "rare",
    "perks": [
      {
        "slot": 0,
        "perk": "safety_net"
      },
      {
        "slot": 0,
        "perk": "sweeper_keeper"
      },
      {
        "slot": 0,
        "perk": "clean_sheet_legacy"
      },
      {
        "slot": 1,
        "perk": "own_third_anchor"
      },
      {
        "slot": 1,
        "perk": "last_ditch"
      },
      {
        "slot": 1,
        "perk": "bulwark_stance"
      },
      {
        "slot": 1,
        "perk": "pivot_duo"
      },
      {
        "slot": 2,
        "perk": "own_third_anchor"
      },
      {
        "slot": 2,
        "perk": "last_ditch"
      },
      {
        "slot": 2,
        "perk": "pivot_duo"
      },
      {
        "slot": 2,
        "perk": "bruised_knuckles"
      },
      {
        "slot": 3,
        "perk": "center_conductor"
      },
      {
        "slot": 3,
        "perk": "high_press_trigger"
      },
      {
        "slot": 3,
        "perk": "natural_leader"
      },
      {
        "slot": 3,
        "perk": "covering_shadow"
      },
      {
        "slot": 4,
        "perk": "pivot_duo"
      },
      {
        "slot": 4,
        "perk": "diagonal_press"
      },
      {
        "slot": 4,
        "perk": "cold_focus"
      },
      {
        "slot": 4,
        "perk": "road_warrior"
      },
      {
        "slot": 5,
        "perk": "pivot_duo"
      },
      {
        "slot": 5,
        "perk": "diagonal_press"
      },
      {
        "slot": 5,
        "perk": "wing_overlap"
      },
      {
        "slot": 5,
        "perk": "cold_focus"
      },
      {
        "slot": 6,
        "perk": "box_predator"
      },
      {
        "slot": 6,
        "perk": "forward_line"
      },
      {
        "slot": 6,
        "perk": "long_range_menace"
      },
      {
        "slot": 6,
        "perk": "cold_focus"
      }
    ],
    "styles": {
      "1": "Bulwark",
      "4": "Cold",
      "5": "Cold",
      "6": "Cold"
    },
    "traits": {
      "3": [
        "Leader"
      ]
    }
  },
  "modifiers": [
    {
      "id": "sealed_goal",
      "name": {
        "es": "Portería sellada",
        "en": "Sealed Goal"
      },
      "kind": "banChannel",
      "probability": "ShotOnTarget"
    },
    {
      "id": "iron_curtain",
      "name": {
        "es": "Cerrojo",
        "en": "Iron Curtain"
      },
      "kind": "pushBack",
      "column": 6
    }
  ],
  "defeatCondition": {
    "id": "titleholder",
    "name": {
      "es": "El campeón conserva el título",
      "en": "The Champion Retains"
    },
    "kind": "drawIsDefeat"
  },
  "gate": {
    "playerLevel": 7,
    "targets": {
      "incoherent": {
        "max": 10
      },
      "correct": {
        "min": 15,
        "max": 28
      },
      "good": {
        "min": 40,
        "max": 55
      },
      "excellent": {
        "min": 50,
        "max": 70
      }
    }
  }
}
